0.000000 0.000000 IP 192.168.10.201.54438 > 192.168.10.200.1234: Flags [S], seq 4249142048, win 29200, options [mss 1460,nop,nop,sackOK], length 0
0.000024 0.000024 IP 192.168.10.200.1234 > 192.168.10.201.54438: Flags [S.], seq 2975989674, ack 4249142049, win 64240, options [mss 1460,nop,nop,sackOK], length 0
0.000149 0.000125 IP 192.168.10.201.54438 > 192.168.10.200.1234: Flags [.], ack 1, win 29200, length 0
0.000684 0.000535 IP 192.168.10.200.1234 > 192.168.10.201.54438: Flags [P.], seq 1:101, ack 1, win 64240, length 100
0.000924 0.000240 IP 192.168.10.201.54438 > 192.168.10.200.1234: Flags [.], ack 101, win 29200, length 0
0.000939 0.000015 IP 192.168.10.200.1234 > 192.168.10.201.54438: Flags [P.], seq 101:1001, ack 1, win 64240, length 900
0.001070 0.000131 IP 192.168.10.201.54438 > 192.168.10.200.1234: Flags [.], ack 1001, win 30600, length 0
1.000921 0.999851 IP 192.168.10.200.1234 > 192.168.10.201.54438: Flags [P.], seq 1001:1101, ack 1, win 64240, length 100
1.001040 0.000119 IP 192.168.10.201.54438 > 192.168.10.200.1234: Flags [.], ack 1101, win 30600, length 0
1.001056 0.000016 IP 192.168.10.200.1234 > 192.168.10.201.54438: Flags [P.], seq 1101:2001, ack 1, win 64240, length 900
1.001239 0.000183 IP 192.168.10.201.54438 > 192.168.10.200.1234: Flags [.], ack 2001, win 32400, length 0
2.001161 0.999922 IP 192.168.10.200.1234 > 192.168.10.201.54438: Flags [P.], seq 2001:2101, ack 1, win 64240, length 100
2.001418 0.000257 IP 192.168.10.201.54438 > 192.168.10.200.1234: Flags [.], ack 2101, win 32400, length 0
2.001434 0.000016 IP 192.168.10.200.1234 > 192.168.10.201.54438: Flags [P.], seq 2101:3001, ack 1, win 64240, length 900
2.001678 0.000244 IP 192.168.10.201.54438 > 192.168.10.200.1234: Flags [.], ack 3001, win 34200, length 0
3.001407 0.999729 IP 192.168.10.200.1234 > 192.168.10.201.54438: Flags [P.], seq 3001:3101, ack 1, win 64240, length 100
3.001717 0.000310 IP 192.168.10.201.54438 > 192.168.10.200.1234: Flags [.], ack 3101, win 34200, length 0
3.001730 0.000013 IP 192.168.10.200.1234 > 192.168.10.201.54438: Flags [P.], seq 3101:4001, ack 1, win 64240, length 900
3.001968 0.000238 IP 192.168.10.201.54438 > 192.168.10.200.1234: Flags [.], ack 4001, win 36000, length 0
4.001529 0.999561 IP 192.168.10.200.1234 > 192.168.10.201.54438: Flags [P.], seq 4001:4101, ack 1, win 64240, length 100
4.001853 0.000324 IP 192.168.10.201.54438 > 192.168.10.200.1234: Flags [.], ack 4101, win 36000, length 0
4.001867 0.000014 IP 192.168.10.200.1234 > 192.168.10.201.54438: Flags [P.], seq 4101:5001, ack 1, win 64240, length 900
4.002105 0.000238 IP 192.168.10.201.54438 > 192.168.10.200.1234: Flags [.], ack 5001, win 37800, length 0
5.001847 0.999742 IP 192.168.10.200.1234 > 192.168.10.201.54438: Flags [F.], seq 5001, ack 1, win 64240, length 0
5.002295 0.000448 IP 192.168.10.201.54438 > 192.168.10.200.1234: Flags [F.], seq 1, ack 5002, win 37800, length 0
5.002314 0.000019 IP 192.168.10.200.1234 > 192.168.10.201.54438: Flags [.], ack 2, win 64239, length 0
