0.000000 0.000000 IP 192.168.10.201.60920 > 192.168.10.200.1234: Flags [S], seq 1682893850, win 29200, options [mss 1460,nop,nop,sackOK], length 0
0.000032 0.000032 IP 192.168.10.200.1234 > 192.168.10.201.60920: Flags [S.], seq 2445932654, ack 1682893851, win 64240, options [mss 1460,nop,nop,sackOK], length 0
0.000255 0.000223 IP 192.168.10.201.60920 > 192.168.10.200.1234: Flags [.], ack 1, win 29200, length 0
0.000855 0.000600 IP 192.168.10.200.1234 > 192.168.10.201.60920: Flags [P.], seq 1:101, ack 1, win 64240, length 100
0.000869 0.000014 IP 192.168.10.200.1234 > 192.168.10.201.60920: Flags [P.], seq 101:301, ack 1, win 64240, length 200
0.000910 0.000041 IP 192.168.10.200.1234 > 192.168.10.201.60920: Flags [P.], seq 301:1001, ack 1, win 64240, length 700
0.001012 0.000102 IP 192.168.10.201.60920 > 192.168.10.200.1234: Flags [.], ack 101, win 29200, length 0
0.001013 0.000001 IP 192.168.10.201.60920 > 192.168.10.200.1234: Flags [.], ack 301, win 30016, length 0
0.001051 0.000038 IP 192.168.10.201.60920 > 192.168.10.200.1234: Flags [.], ack 1001, win 31500, length 0
1.001103 1.000052 IP 192.168.10.200.1234 > 192.168.10.201.60920: Flags [P.], seq 1001:1101, ack 1, win 64240, length 100
1.001117 0.000014 IP 192.168.10.200.1234 > 192.168.10.201.60920: Flags [P.], seq 1101:1301, ack 1, win 64240, length 200
1.001144 0.000027 IP 192.168.10.200.1234 > 192.168.10.201.60920: Flags [P.], seq 1301:1901, ack 1, win 64240, length 600
1.001229 0.000085 IP 192.168.10.200.1234 > 192.168.10.201.60920: Flags [P.], seq 1901:2001, ack 1, win 64240, length 100
1.001342 0.000113 IP 192.168.10.201.60920 > 192.168.10.200.1234: Flags [.], ack 1101, win 31500, length 0
1.001343 0.000001 IP 192.168.10.201.60920 > 192.168.10.200.1234: Flags [.], ack 1301, win 32900, length 0
1.001343 0.000000 IP 192.168.10.201.60920 > 192.168.10.200.1234: Flags [.], ack 2001, win 34300, length 0
2.001367 1.000024 IP 192.168.10.200.1234 > 192.168.10.201.60920: Flags [P.], seq 2001:2101, ack 1, win 64240, length 100
2.001381 0.000014 IP 192.168.10.200.1234 > 192.168.10.201.60920: Flags [P.], seq 2101:2301, ack 1, win 64240, length 200
2.001447 0.000066 IP 192.168.10.200.1234 > 192.168.10.201.60920: Flags [P.], seq 2301:3001, ack 1, win 64240, length 700
2.001490 0.000043 IP 192.168.10.201.60920 > 192.168.10.200.1234: Flags [.], ack 2101, win 34300, length 0
2.001490 0.000000 IP 192.168.10.201.60920 > 192.168.10.200.1234: Flags [.], ack 2301, win 35700, length 0
2.001680 0.000190 IP 192.168.10.201.60920 > 192.168.10.200.1234: Flags [.], ack 3001, win 37100, length 0
3.001607 0.999927 IP 192.168.10.200.1234 > 192.168.10.201.60920: Flags [P.], seq 3001:3101, ack 1, win 64240, length 100
3.001621 0.000014 IP 192.168.10.200.1234 > 192.168.10.201.60920: Flags [P.], seq 3101:3301, ack 1, win 64240, length 200
3.001686 0.000065 IP 192.168.10.200.1234 > 192.168.10.201.60920: Flags [P.], seq 3301:4001, ack 1, win 64240, length 700
3.001829 0.000143 IP 192.168.10.201.60920 > 192.168.10.200.1234: Flags [.], ack 3101, win 37100, length 0
3.001830 0.000001 IP 192.168.10.201.60920 > 192.168.10.200.1234: Flags [.], ack 3301, win 38500, length 0
3.001830 0.000000 IP 192.168.10.201.60920 > 192.168.10.200.1234: Flags [.], ack 4001, win 39900, length 0
4.001852 1.000022 IP 192.168.10.200.1234 > 192.168.10.201.60920: Flags [P.], seq 4001:4101, ack 1, win 64240, length 100
4.001866 0.000014 IP 192.168.10.200.1234 > 192.168.10.201.60920: Flags [P.], seq 4101:4301, ack 1, win 64240, length 200
4.001932 0.000066 IP 192.168.10.200.1234 > 192.168.10.201.60920: Flags [P.], seq 4301:5001, ack 1, win 64240, length 700
4.002063 0.000131 IP 192.168.10.201.60920 > 192.168.10.200.1234: Flags [.], ack 4101, win 39900, length 0
4.002064 0.000001 IP 192.168.10.201.60920 > 192.168.10.200.1234: Flags [.], ack 4301, win 41300, length 0
4.002065 0.000001 IP 192.168.10.201.60920 > 192.168.10.200.1234: Flags [.], ack 5001, win 42700, length 0
5.002213 1.000148 IP 192.168.10.200.1234 > 192.168.10.201.60920: Flags [F.], seq 5001, ack 1, win 64240, length 0
5.002674 0.000461 IP 192.168.10.201.60920 > 192.168.10.200.1234: Flags [F.], seq 1, ack 5002, win 42700, length 0
5.002693 0.000019 IP 192.168.10.200.1234 > 192.168.10.201.60920: Flags [.], ack 2, win 64239, length 0
5.042135 0.039442 ARP, Request who-has 192.168.10.200 tell 192.168.10.201, length 46
5.042144 0.000009 ARP, Reply 192.168.10.200 is-at 00:15:17:4b:37:cd, length 28
